type,date,media,title,content,url
news,2017-07-04 11:20:00,조세일보,"BNK부산銀, 핀테크 인턴 6명 선발","BNK금융그룹 부산은행이 디지털 금융 인재 발굴 육성을 위해 지난 6월 모집한 '2017 BNK핀턴쉽 프로그램' 최종합격자 6명을 선발했다고 4일 밝혔다.'핀턴쉽'은 핀테크(Fintech)와 인턴쉽(Internship)의 합성어로 핀테크 신사업 발굴 및 기획, 컨설팅 등의 업무를 수행하는 인턴 직원이며 핀테크 분야에 특화된 인턴 직원을 채용한 사례는 금융권에서는 부산은행이 처음이다.최종 합격한 6명의 '핀턴'은 본격적인 근무에 앞서 7월 한 달간 부산은행 모바일 은행인 '썸뱅크'와 부산은행 영업점(셀프뱅크 및 스마트스퀘어 포함)에서 직접 실무를 경험하고 본점 디지털 금융 부서에서 체계적인 교육을 받게 된다.이후 4달 동안 부산은행 디지털 금융 전략에 대한 컨설팅 업무와 핀테크 신사업 기획 및 관련 개별 미션 등 다양한 업무를 수행하게 된다.부산은행은 핀턴쉽 참여자들에게 매월 일정 급여와 함께 활동 후 장학금 지원(근무평점 순) 및 내년도 부산은행 공채 지원 시 가산점도 부여받을 수 있다. 본인이 기획한 핀테크 사업 모델을 바탕으로 핀테크 창업지원, 공동사업 추진 등도 가능하다.BNK부산은행 빈대인 은행장 직무대행은 “금융권에서 처음으로 시행되는 핀턴쉽 프로그램이 핀테크 산업 활성화와 부산은행 신성장 동력 발굴 및 관련 인재 양성 등에 많은 도움이 되길 기대한다”라고 전했다.▶ [HOT]당신의 10분 몸 만들기...황현정기자의 쭉쭉빵빵▶ [HOT]세무·회계 실무, 맞춤형 교육 '조세일보 재무교육원'..임순택(kookje@joseilbo.com)저작권자 ⓒ 조세일보(http://www.joseilbo.com). 무단전재 및 재배포 금지",http://www.joseilbo.com/news/news_read.php?uid=329237&class=17&grp=
news,2017-07-04 03:49:00,조세일보,"블록체인·물류·AI플랫폼...삼성SDS, 국내외 공략 '구슬땀'","삼성SDS(대표 정유성)가 최근 유럽 최대 핀테크 행사에서 블록체인 사업 발표에 나서는가하면 인도네시아 물류BPOTLWKD 공략을 가속화하고 AI(인공지능)기반 분석플랫폼을 선보이는 등 국내외 시장 공략에 구슬땀을 흘리고 있다.삼성SDS에서 전해온 관련 소식을 소개한다.유럽 최대 핀테크 행사에서 블록체인 사업 발표◆…홍원표 사장이 'Money 20/20 Europe'에서 기조연설을 하고 있다...삼성SDS 제공먼저 삼성SDS는 지난달 유럽 최대 글로벌 핀테크 콘퍼런스 'Money 20/20 Europe'행사에서 자사의 블록체인 기술 소개 및 미래 사업 비전을 제시했다.지난달 27일(현지 시간) 삼성SDS 홍원표 사장(솔루션사업부문장)은 이번 행사에 기조 연설자로 나서 '블록체인의 상용화, 디지털 금융을 넘어'라는 주제로 삼성SDS의 블록체인 플랫폼인 NexledgerTM(넥스레저)를 소개하고 스마트계약의 일종인 보험청구와 지불자동화, 디지털 물류 등 블록체인의 확산 모델을 제시했다. 영국 바클레이즈, 스페인 BBVA은행 CEO 등과 함께 기조 연설자로 나선 홍 사장은 NexledgerTM (넥스레저)를 기반으로 디지털신분증 및 지급결제서비스 등을 개발한 역량과 전자문서원본확인, FIDO(Fast IDentity Online) 생체인증 보안강화 및 제휴사 자동로그인 등에 적용하여 상용화한 사례를 참석자들에게 소개해 큰 관심을 이끌어 냈다.   홍원표 사장은“블록체인에 대한 관심이 집중된 세계적인 행사에서 삼성SDS의 기술력을 알릴 기회를 갖게 되어 기쁘다”며 “글로벌 시장에서도 블록체인의 상용화가 초기 단계인 만큼 삼성SDS의 경쟁력을 기반으로 시장을 선도해 가겠다”고 포부를 밝혔다.AI기반 분석플랫폼 'Brightics AI' 공개이에 앞서 지난달 21일에는 인공지능(AI)기반 분석플랫폼 'Brightics AI'를 공개하며 기업용(B2B) 시장 공략 강화에 나설 것임을 밝히기도 했다.  이날 삼성SDS 윤심 전무(연구소장)는 잠실 삼성SDS 타워에서 열린 미디어 설명회에서 다양한 대용량 데이터를 AI 기술을 활용해 쉽고, 똑똑하고, 빠르게 분석하는 기업向 통합분석 플랫폼 'Brightics AI'를 공개했다. ◆…AI기반 분석플랫폼 미디어 설명회에서 윤심 전무(연구소장)가 Brightics AI에 대해 소개하고 있다...삼성SDS 제공통상 최소 2명 이상의 전문가가 최대 3개월간 분석모델을 만들어 빅데이터를 분석해야 하지만 'Brightics AI'는 최적의 알고리즘 자동추천 기능으로 일반 현업 사용자도 2시간내로 분석작업을 쉽게 수행할 수 있다는 것이 삼성SDS 측 설명이다.  특히 'Brightics AI'는 또한 제조·마케팅·물류 등 업종별 다양한 AI분석 모델을 기반으로 해결책까지 제시하는 처방(Prescriptive)형 알고리즘을 갖춘 세계 최초의 스마트(똑똑한)한 기업向 플랫폼이라는 것.  더욱이 강화학습 창시자인 캐나다 알버타大의 리차드 서튼 교수는 강화학습 알고리즘을 확장성 있게 제공하는 삼성SDS의 처방형 알고리즘을 적용한 플랫폼기술을 세계 최고 수준이라고 극찬하기도 했다고 강조했다. 특히 수억 건의 데이터를 수집, 분석, 시각화하기까지 일반적으로 3시간 이상이 걸리던 과정을 'Brightics AI'를 활용하면 20배 단축한 10분 이내에 처리가 가능하다는 설명이다. 삼성SDS는 그 동안 'Brightics AI'를 제조·마케팅·물류· 보안·IoT·헬스 분야 등 70여개 업종에 적용한 바 있으며, 앞으로 서비스, 금융 등의 분야로 까지 확대할 계획이다.게다가 'Brightics AI'는 고객 적용사례로 2년 연속 기술혁신분야 세계 최고 권위상인 CIO 100 어워즈에 선정됐고, 초보 분석가도 쉽고 빠르게 데이터 분석을 할 수 있는 사용자 경험을 제공함으로써 지난 5월 세계 3대 디자인상의 하나인 美 IDEA상을 수상했다고 전했다.  한편, Brightics는 Bright와 Analytics의 합성어로 데이터에서 Bright한 Insight를 Analytics를 통해서 얻어내겠다는 삼성SDS의 의지를 나타낸다.인도네시아 물류BPO 등 해외시장 공략 가속이뿐만이 아니다. 삼성SDS는 인도네시아 코린도(Korindo)그룹과 글로벌 통합물류 운영에서 전략적 협약식을 체결하며 글로벌 물류BPO사업 공략에도 속도를 내고 있다.  코린도 그룹은 인도네시아에 진출한 대표적인 한국인 투자 기업으로 자원 및 제지사업을 비롯, 중공업, 물류, 화학 등 30여개 계열사를 보유한 종합 개발회사이다. 삼성SDS는 이번 전략적 협약을 통해 해외 현지 물류실행력을 보완하고 대외 매출을 확대할 계획이며 코린도 그룹은 삼성SDS의 물류플랫폼인 첼로(Cello) 기반의 물류 고도화를 추진해 국제운송 경쟁력을 확보한다는 복안이다.  이에 양사는 물류부문에서 사업 협력모델을 만들고 향후 합작회사(Joint Venture)로 발전시킬 계획이다.  삼성SDS 김형태 SL사업부장(부사장)은 “해외 현지 물류 실행력을 더욱 강화하고 대외고객을 확보하는 계기가 될 것”이라며 “지속성장을 위해 대외사업을 적극 추진할 계획”이라고 말했다. 삼성SDS는 앞서 인도네시아 아딧야(Aditya)社와 5년간 1500억원 규모(연 300억원)의 물류 BPO사업 계약을 체결한 바 있으며, 지난해 태국 통관전문 물류기업인 아큐텍社, 베트남 항공화물 터미널 업체 알스(ALS)社와 합작회사 설립을, 또 지난 5월에는 중국 Kerry社와도 JV설립에 합의함으로써 글로벌시장 확대를 지속 추진하고 있다. ▶ [HOT]당신의 10분 몸 만들기...황현정기자의 쭉쭉빵빵▶ [HOT]세무·회계 실무, 맞춤형 교육 '조세일보 재무교육원'..민경종(kj-min@joseilbo.com)저작권자 ⓒ 조세일보(http://www.joseilbo.com). 무단전재 및 재배포 금지",http://www.joseilbo.com/news/news_read.php?uid=329293&class=17&grp=
news,2017-06-30 10:00:00,조세일보,"KB금융, 핀테크 스타트업 해빗팩토리에 1억5000만원 투자","KB금융은 30일 핀테크 스타트업 해빗팩토리에 1억 5000만원을 투자했다고 밝혔다.이번 투자는 KB금융 계열사 중 벤처투자를 전문으로 하는 KB인베스트먼트에서 Seed 투자의 형태로 진행됐다.해빗팩토리는 금융사의 SMS와 푸쉬 메시지에 담긴 고객의 금융 데이터를 분석해 맞춤형 금융상품을 추천하는 통합 자산관리솔루션을 보유한 업체이다.앞서 KB증권은 해빗팩토리와 업무 제휴를 통해 소비패턴 분석 기반 생활자금관리 서비스 앱인 '스마트코치(Smart Coach)'를 출시했다.또 지난해 7월 KB금융의 핀테크 육성을 담당하고 있는 KB 이노베이션HUB는 해빗팩토리의 기술이 카드, 은행 등 계열사에 확대 적용될 수 있을 것으로 보고 KB 스타터스(KB금융그룹이 육성하는 핀테크 기업) 14호 업체로 지정해 맞춤형 지원을 시작했다.그 성과로 해빗팩토리는 작년 11월 KB국민카드의 통합멤버십 플랫폼 Liiv-mate에 신용카드 소비패턴 분석 솔루션을 제공했다. 이달 말에는 KB금융그룹의 글로벌 디지털 뱅크 KB Liiv 캄보디아에 통신비 잔액 관리 솔루션을 개발해 제공할 예정이다. KB금융 관계자는 ""금융기관의 제휴와 투자는 핀테크 스타트업에게 가장 실질적인 도약의 계기를 제공한다""며 ""KB금융은 특화된 기술과 참신한 아이디어를 보유한 스타트업과 함께 성장하며 고객이 원하는 금융의 모습을 빠르게 구현해 내겠다""고 말했다. KB금융은 지난 2년간 핀테크 스타트업에 대해 총 48억을 투자했다. 아울러 우수한 기술을 보유한 핀테크 기업과의 제휴를 강화하기 위해 전략적 투자 규모를 지속적으로 늘려갈 계획이다. ▶ [HOT]당신의 10분 몸 만들기...황현정기자의 쭉쭉빵빵▶ [HOT]세무·회계 실무, 맞춤형 교육 '조세일보 재무교육원'..박지환(pjh@joseilbo.com)저작권자 ⓒ 조세일보(http://www.joseilbo.com). 무단전재 및 재배포 금지",http://www.joseilbo.com/news/news_read.php?uid=328913&class=51&grp=
news,2017-06-28 06:44:00,조세일보,"""4차 산업혁명이 보험수요 증진시킬 것""","◆…생명보험협회와 보험연구원은 28일 상공회의소에서 '4차 산업혁명과 인슈어테크 활용' 국제세미나를 열었다. 사진=생명보험협회 제공.생명보험협회와 보험연구원은 28일 서울 중구 대한상공회의소에서 '4차 산업혁명과 인슈어테크 활용' 국제세미나를 열었다.이수창 생명보험협회장은 개회사에서 ""보험산업은 다양한 데이터와 통계, 확률을 시스템화한 산업으로 4차산업 혁명의 한 축인 빅데이터 산업의 원조""라며 ""오늘 세미나가 위기상황에서 보험업계가 미래 성장을 도모하는 새 돌파구가 되면 좋겠다""고 말했다.인슈어테크는 보험(insurance)과 정보기술(IT)의 합성어로 정보기술을 활용해 제공하는 보험 서비스를 의미한다. 이날 세미나에서는 국내 보험산업의 4차 산업 대비 현황, 해외 보험사의 사물인터넷과 블록체인 등 4차 기술 활용 사례, AI(인공지능)를 활용한 보험금 지급산정 등 4차 산업혁명이 보험산업에 미치는 영향들이 논의됐다.황인창 보험연구원 연구위원은 ""4차 산업혁명 기술이 보험수요를 증진시킬 수 있다""고 주장했다. 황 연구위원은 ""지불능력을 예측하고 정보비대칭성을 감소시키는 등 빅데이터와 AI를 활용한 지능정보기술로 보험시장의 비효율성으로 인한 보장격차를 완화시킨다""며 ""이를 통해 각 소비자에게 적합한 개별화된 상품을 보다 저렴한 가격에 제공할 수 있게 된다""는 긍정적 전망을 내놓았다. 그는 ""국내 보험업계는 비용 대비 수익이 불확실하다고 여겨 대응이 미진하다""고 지적하고 ""정책, 경영 측면에서 불확실성을 해소하고 사이버 리스크 등 4차 산업혁명 시대에 새롭게 발생할 리스크에 선제 대응하는 것이 중요하다""고 말했다. 박소정 서울대 교수는 보험사가 다양한 분야에서 사물인터넷을 사용한 사례들을 소개했다. 가입자의 웨어러블기기로 운동량을 측정해 건강보험료에 인센티브를 주는 미국의 존 핸콕사나 현재 국내에서도 도입중인 운전습관 연계 보험을 대표 사례로 소개했다. 박 교수는 사물인터넷 및 웨어러블 기기의 보급으로 위험을 미리 줄이는 것이 가능해져 보험의 개념이 사후 보상에서 선제 관리로 바뀔 수 있다고 예견했다.후쿠쿠생명의 하타 타카시 보험금부장은 자사의 지급심사 업무에 IBM의 인공지능 왓슨 익스플로러를 도입한 경험을 소개했다. 인간은 복잡한 판단이 가능하지만 누락 등의 실수가 있고 왓슨 익스플로러는 실수는 없지만 단순한 판단만 가능하므로 사람과 인공지능 기술이 함께 업무를 진행할 때 효율성과 정확성이 향상되었다고 밝혔다.RGA재보험의 조르지오 모시스 혁신 임원은 국내외 보험사에서 블록체인 기술을 보험산업에 적용하기 위해 시도 중인 사례들을 설명했다. 국내 사례로는 교보생명의 블록체인 기반 보험금 자동지급서비스가 소개됐다. B3i는 블록체인을 보험업에 활용하기 위해 국제 보험사들이 2016년 10월에 결성한 이니셔티브다.한화생명의 황승준 미래전략실장은 리스크, 고객 모집, 인재발굴, 언더라이팅 등 여러 분야에서 한화생명이 보험 관련 빅데이터를 어떻게 업무에 사용중인지 소개하는 시간을 가졌다.주제발표가 끝난 후에는 김대식 한양대학교 교수, 김석영 보험연구원 금융정책실장, 손주형 금융위원회 금융서비스국 보험과 과장과 당일 발제자들이 패널로 참가한 종합토론이 진행됐다.◆…생명보험협회가 연 국제세미나에 참석한 주요 인사들.  사진=생명보험협회 제공.▶ [HOT]당신의 10분 몸 만들기...황현정기자의 쭉쭉빵빵▶ [HOT]세무·회계 실무, 맞춤형 교육 '조세일보 재무교육원'..김연지(yjkim@joseilbo.com)저작권자 ⓒ 조세일보(http://www.joseilbo.com). 무단전재 및 재배포 금지",http://www.joseilbo.com/news/news_read.php?uid=328751&class=52&grp=
news,2017-06-21 09:36:00,조세일보,"NH농협은행, 핀테크 기업과 농촌 일손돕기","◆…NH농협은행 핀테크사업부 직원들과 핀테크기업 임직원들이 화성시 송산면 고포2리마을에서 농촌 일손돕기 후 기념촬영을 하고 있다. 사진 농협은행 제공.  NH농협은행은 20일 경기도 화성시 포도농장을 찾아 핀테크 기업 임직원들과 함께 농촌 일손돕기를 진행했다고 21일 밝혔다.이날 일손돕기는 한국P2P협회 회장사인 미드레이트와 크라우드 펀딩 선도자 유캔스타트, 농산물 생산자와 소비자를 이어주는 팜토리 등 'NH핀테크 혁신센터'의 멘토링기업 임직원들이 함께 했다.김태웅 유캔스타트 대표는 ""농업인들이 겪고 있는 가뭄 등의 어려움은 국민 모두가 나눠야 할 것이라는 생각에 일손돕기에 참여했다""고 말했다.이창기 농협은행 핀테크사업부장은 ""범농협차원의 일손돕기에 핀테크기업에서 참여해줘 감사하다""며 ""'NH핀테크 오픈플랫폼' 등으로 핀테크기업과 동반성장중이며 앞으로도 지원을 아끼지 않겠다""고 밝혔다.▶ [HOT]당신의 10분 몸 만들기...황현정기자의 쭉쭉빵빵▶ [HOT]세무·회계 실무, 맞춤형 교육 '조세일보 재무교육원'..박지환(pjh@joseilbo.com)저작권자 ⓒ 조세일보(http://www.joseilbo.com). 무단전재 및 재배포 금지",http://www.joseilbo.com/news/news_read.php?uid=327936&class=51&grp=
news,2017-06-20 06:40:00,조세일보,"하나금융, 핀테크 중심시대 열 데이터센터 준공","◆…20일 오후 인천 청라국제도시에서 열린 하나금융그룹 통합데이터센터 준공식에서 김정태 하나금융그룹 회장(사진 왼쪽 여섯번째), 송영길 국회의원(사진 왼쪽에서 다섯번째) 등 준공식에 참석한 이들이 테이프 커팅식을 하고 있다.=하나금융그룹 제공하나금융그룹은 20일 인천 청라국제도시에서 하나금융타운 1단계 조성 사업인 그룹 통합데이터센터 준공식을 개최했다고 밝혔다.국내 금융권 최초로 시도되는 통합데이터센터는 기존 은행, 증권, 카드, 보험, 캐피탈 등 13개 관계사별로 분산되어 관리해 오던 IT 인프라와 인력을 집중화함으로써 시너지를 극대화한다.이를 통해 △비용절감 △유연하고도 효율적인 데이터의 관리 및 활용 △그룹 내 IT인력 간 교류 활성화 △글로벌, 모바일, 핀테크, 보안 분야의 핵심 신기술 추진 등으로 더욱 유용하고 편리한 서비스 제공이 가능해질 전망이다.청라국제도시에 조성 중인 하나금융타운은 1단계 사업으로 통합데이터센터를 2015년 6월에 착공한 이후 2년 만에 완공했다. 지난달에는 통합데이터센터 바로 맞은 편에 2단계 사업인 '하나글로벌인재개발원'을 착공했다.김정태 하나금융그룹 회장은 준공식에서 ""4차 산업혁명 시대에 IT는 모든 산업의 중심에 있다""며 ""지난 4월에 설립한 인도네시아 현지 IT 법인 설립과 이번 그룹 통합데이터센터 구축을 계기로 핀테크가 중심이 되는 글로벌 진출의 발판을 만들어 나갈 것""이라고 말했다.▶ [HOT]당신의 10분 몸 만들기...황현정기자의 쭉쭉빵빵▶ [HOT]세무·회계 실무, 맞춤형 교육 '조세일보 재무교육원'..박지환(pjh@joseilbo.com)저작권자 ⓒ 조세일보(http://www.joseilbo.com). 무단전재 및 재배포 금지",http://www.joseilbo.com/news/news_read.php?uid=327914&class=51&grp=
news,2017-06-16 03:56:00,미디어오늘(과거),규제완화론자 ‘먹잇감’ 돼버린 국회 미래일자리특위,"발의채택 법안 절반이 한 민간 전문가 아이디어, “일자리 창출 아닌 산업계 규제완화 로비 수단 악용될 우려” 지적도[미디어오늘 금준경 기자]국회 미래일자리특별위원회(위원장 정동영)가 발의를 채택한 법안 50%가 한 사람의 아이디어인 것으로 나타났다. 특위 설치목적과 달리 일자리 창출보다는 규제완화를 요구하는 일방적인 입장을 수용했다는 비판이 나온다. 미래일자리특위는 지난해 4월 안철수 전 국민의당 대표의 제안으로 만든 특별위원회다. 일자리 창출을 위한 법안에 대한 아이디어를 각계각층의 전문가들로부터 청취한 후 법안으로 만드는 일을 한다. 문제는 일자리와 직접적인 관련이 없는 법안이 많은 데다 규제완화 입장을 가진 전문가가 제안한 아이디어 채택 비율이 지나치게 높았다는 점이다. 미디어오늘이 입수한 자료에 따르면 미래일자리특위는 지난 13일 논의 대상 27개 검토법안 중 12개 법안의 발의를 채택했는데, 이 중 6개 법안의 ‘아이디어 제안자’가 구태언 테크앤로법률사무소 대표 변호사다. ▲ 미래일자리특별위원회가 발의를 채택한 법안. 아이디어 제안자는 대외적으로 공표되지 않았다. 구태언 변호사의 법안은 △신용카드 활용 핀테크 서비스 도입을 위한 신용카드 결제범위 확대 △신용카드 모집인업무 관련 일사 전속주의 규제 폐지 △신용카드 터치 본인확인서비스 이중규제 개선 △금융사기 가해자의 계좌정보를 은행에 제공할 수 있는 근거 마련 △지방자치단체의 실정에 따라 자율주행차 허용범위확대 △내국인을 대상으로 하는 도시민박업 허용 등이다. 구태언 변호사는 개인정보 규제 완화를 주장해온 전문가로 박근혜 정부 추천 개인정보보호위원으로 활동하고 있다. 과거 CPO포럼 부회장, 한국인터넷기업협회 고문을 지내기도 했다. CPO포럼은 기업, 유관기관, 학계 등이 모여 개인정보보호 관련 정책수립을 위한 의견 전달 역할을 하고 있으며 SK, KT, KB국민카드, 현대자동차, 김앤장 법률사무소 등이 회원사로 속해 있다. 구태언 변호사가 아이디어를 낸 것 중 ‘금융사기 가해자의 계좌정보를 은행에 제공할 수 있는 근거 마련’ 법안은 담당부처인 개인정보보호위원회에서 “사실관계가 명확히 확인되지 않은 경우 선량한 피해자가 나올 수 있다”며 ‘신중검토’ 의견을 낸 것으로 확인됐지만 미래일자리특위는 발의를 결정했다. 개인정보 규제완화 입장을 지지해온 또 다른 전문가인 이광형 카이스트 문술미래전략대학원장이 아이디어를 낸 법안도 2건 채택됐다. 미채택 법안 15건 중 3건이 이광형 원장의 아이디어인 것으로 나타나기도 했는데 개인정보 범위 축소, 개인정보 사전규제방식을 사후규제로 전환, 개인정보법 위반에 따른 형사처벌 축소 등의 내용으로 개인정보보호 체계의 근간을 흔든다는 지적을 받았으며 담당 부처 역시 부정적인 의견을 냈다. 문제는 미채택법안은 ‘파기’ 결정된 게 아니라 ‘보류법안’으로 분류돼 다시 발의가 추진될 수 있다는 점이다. 반면 아이디어 제안자 중 노동계 전문가로 김성혁 금속노조 노동연구원장이 △납품단가 연동제 △지주회사에 대해 자회사만 인정하고 손자회사 금지 △법정 근로시간 35시간 도입 법안을 제안했으나 모두 ‘미채택’됐다. ▲ 일러스트= 권범철 만평작가. 미래일자리특위 관계자는 “산업분야별, 단체별로 개선사항을 취합해 논의했고 이견이 없는 법안은 우선 채택했다”면서 “(채택된) 모든 법안이 바로 발의되는 건 아니고, 해당 상임위에 발의를 건의하거나 특위 소속 의원들이 발의하는 방식이 될 것”이라고 말했다. 이처럼 규제완화 입장을 가진 전문가들의 요구가 대거 수용되자 시민사회단체는 황당하다는 반응이다. 김보라미 경제정의실천시민연합 소비자정의센터 고문 변호사는 “미래일자리특위라고 이름을 지어놓고선 일자리와 무관한 법안들을 채택했다. 반대의견을 내는 단체의 의견 역시 수렴하지 않고 공개적인 논의절차도 없었던 것으로 보인다”면서 “결과적으로 금융사 등 특정 기업의 합법적 ‘로비창구’로 악용될 수 있다”고 지적했다.금준경 기자[미디어오늘 바로가기] [미디어오늘 페이스북]미디어오늘을 지지·격려하는 [가장 확실한 방법]<저작권자 ⓒ 미디어오늘(http://www.mediatoday.co.kr) 무단전재 및 재배포 금지>",http://www.mediatoday.co.kr/?mod=news&act=articleView&idxno=137415
